EIN,Name,City,State
521230183,PACT HELPING CHILDREN WITH SPECIAL NEEDS INC,BALTIMORE,MD
451253812,PALLAS THEATRE COLLECTIVE INC,ROCKVILLE,MD
680652119,PAN AFRICA CHILDREN ADVOCACY WATCH INC,BETHESDA,MD
454913732,PARENT BOOSTER USA INC,JOPPA,MD
522269399,PARENTING PLUS ASSOC INC,NORTH POTOMAC,MD
264748475,PARENTS ASSOCIATION ROCHAMBEAU,FT WASHINGTON,MD
522075563,PARENTS CLUB OF BOY SCOUT TROOP 497 INC,TOWSON,MD
237263795,PARENTS COUNCIL OF WASHINGTON,BETHESDA,MD
521693204,PARENTS PLACE OF MARYLAND INC,GLEN BURNIE,MD
522212266,PARK HEIGHTS COMMUNITY HEALTH ALLIANCE INC,BALTIMORE,MD
262982081,PARK SIDE MANAGEMENT INC,OAKLAND,MD
542048636,PARKINSON FOUNDATION OF THE NATIONAL CAPITAL AREA INC,SILVER SPRING,MD
451605551,PARTNERS FOR CANCER CARE AND PREVENTION INC,BALTIMORE,MD
901028797,PARTNERS FOR LEADERSHIP RESOURCES FOR CHURCHES IN AFRICA,EASTON,MD
233097238,PARTNERSHIP FOR QUALITY MEDICAL DONATIONS,ANNAPOLIS,MD
562317509,PASADENA CHARGERS INC,PASADENA,MD
510289509,PASCAL SENIORS INCORPORATED,GLEN BURNIE,MD
462215455,PATHWAY TO HEALTHY FAMILIES,FT WASHINGTON,MD
300186963,PATRICK JOHN BENNETT JR MEMORAL FUND,COCKEYSVILLE,MD
522044708,PATRIOTS INC,CAPITOL HEIGHTS,MD
522193891,PATTERSON FOUNDATION INC,CHEVY CHASE,MD
10819395,PATTERSON PARK PUBLIC CHARTER,BALTIMORE,MD
237433886,PATUXENT RIVER NAVAL AIR MUSEUM ASSOCIATION INC,LEXINGTON PK,MD
474692250,PATUXENT RIVER NAVAL AVIATION MUSEUM FOUNDATION,LEONARDTOWN,MD
527011675,PAUL V & MARGARET H RENOFF FAMILY FOUNDATION,BALTIMORE,MD
522042769,PAWS FOR LIFE INC,CHESAPEAKE CY,MD
461726716,PAY IT FORWARD INC,ELKRIDGE,MD
452873122,PAYNE FAMILY FOUNDATION,BALTIMORE,MD
753131868,PDG REHABILITATION SERVICES INCORPORATED,MILLERSVILLE,MD
432080719,PEARLSTONE CONFERENCE & RETREAT CENTER INC,REISTERSTOWN,MD
521249913,PEARLSTONE FAMILY FUND INC,BALTIMORE,MD
464081760,PEER2PEER RECOVERY SERVICES,ROCKVILLE,MD
521006116,PEERLESS ROCKVILLE HISTORIC PRESERVATION LTD,ROCKVILLE,MD
520591628,PENINSULA REGIONAL MEDICAL CENTER,SALISBURY,MD
521590195,PENN MAR ORGANIZATION INC,FREELAND,MD
521207942,PENN MAR ORGANIZATION INC,FREELAND,MD
522026972,PENNYGHAEL FOUNDATION INC,BALTIMORE,MD
342014843,PENTECOSTAL CHURCH NEW REBIRTH,BALTIMORE,MD
521110633,PEOPLE FOR BETTER HOUSING INC,FEDERALSBURG,MD
521317246,PEOPLES HOMESTEADING GROUP INC,BALTIMORE,MD
521929077,PEP FOUNDATION INC,BALTIMORE,MD
522130184,PEPPERMAN-ALPERT MEMORIAL SCHOLARSHIP FUND,NORTH POTOMAC,MD
311630132,PERENNIAL GARDEN CLUB,POTOMAC,MD
522121311,PERFORMABILITIES INC,PARKVILLE,MD
465214418,PERFORMING ARTS CENTER FOR AFRICAN CULTURES,LAUREL,MD
526082246,PERRY HALL CHILDRENS CENTER,NOTTINGHAM,MD
521273296,PERSEPOLIS PRODUCTIONS INC,CHEVY CHASE,MD
311658057,PERSEUS FOUNDATION INC,GAITHERSBURG,MD
454863761,PET PANTRIES INCORPORATED,EASTON,MD
464148229,PETER G DODGE FOUNDATION INC,BALTIMORE,MD
452914445,PETER J GOLUEKE FOUNDATION INC,BALTIMORE,MD
521755890,PGACTS INC,UPPR MARLBORO,MD
522133513,PHI,GLEN ARM,MD
331164022,PHILADELPHIA WAX MUSEUM,HYATTSVILLE,MD
237004492,PHILIP R FRIEND FOUNDATION,POTOMAC,MD
320226431,PHILIPPINE MEDICAL ASSOCIATION METROPOLITAN WASHINGTON D C INC,POTOMAC,MD
522255235,PHILIPPINE NURSES ASSOCIATION OF METROPOLITAN D C INC,FORT WASHINGTON,MD
520902697,PHILIPPINES MISSIONS INC,HAGERSTOWN,MD
204519973,PHILLIPS WHARF ENVIRONMENTAL CENTERINC,TILGHMAN,MD
521891740,PHOENIX WILDLIFE CENTER INC,PHOENIX,MD
352312668,PHOTONICS SOCIETY OF CHINESE-AMERICAN ATLANTIC CHAPTER,ODENTON,MD
520739127,PIKESVILLE VOLUNTEER FIRE COMPANY INC,PIKESVILLE,MD
61678451,PLANET HOPE LAND AND SEA,DEALE,MD
475235006,PLANK FOUNDATION FOR ENTREPRENEURSHIP INC,BALTIMORE,MD
521366793,PLAY WISE,RANDALLSTOWN,MD
830352243,PLAYA DEL FUEGO INC,COLLEGE PARK,MD
521698379,PLAYWRIGHTS FORUM,ROCKVILLE,MD
522137781,POLICE ON BIKES INC,BALTIMORE,MD
272998187,POOLESVILLE ATHLETIC ASSOCIATION INC,POOLESVILLE,MD
526041444,POPULATION ASSOCIATION OF AMERICA INC,SILVER SPRING,MD
521191001,PORT TOBACCO PLAYERS INC,LA PLATA,MD
521998685,PORT TOWNS COMMUNITY DEVELOPMENT CORPORATION,BLADENSBURG,MD
522230528,POSITIVE ALTERNATIVES TO DANGEROUS,CROWNSVILLE,MD
462215594,POTENTIAL ME,BALTIMORE,MD
522118801,POTOMAC CASE MANAGEMENT SERVICES INC,HAGERSTOWN,MD
522286949,POTOMAC COMMUNITY RESOURCES INC,POTOMAC,MD
521116578,POTOMAC HEALTHCARE FOUNDATION,BALTIMORE,MD
521750383,POTOMAC HOME SUPPORT INC,ROCKVILLE,MD
521124583,POTOMAC MASSAGE TRAINING INSTITUTE INC,SILVER SPRING,MD
521910115,POTOMAC RIVER HOMES INC,FREDERICK,MD
300255364,POTOMAC SPELEOLOGICAL SOCIETY,UPPR MARLBORO,MD
521236768,POTOMAC VALEY ATHLETIC ASSOCIATION INC,CRESAPTOWN,MD
10933272,POWER OF THE HIGHEST MINISTRIES INTERNATIONAL,ROCKVILLE,MD
463527343,PR HOLMES MINISTRIES,LAUREL,MD
203914964,PRECA EDUCATION FOUNDATION,FT WASHINGTON,MD
521724629,PREGNANCY CENTER INC,BALTIMORE,MD
521731910,PREGNANCY CENTER INC,BEL AIR,MD
526052408,PRESBYTERIAN EYE EAR & THROAT CHARITY HOSP INC BD LADY MANAGERS,BALTIMORE,MD
520607932,PRESBYTERIAN HOME OF MARYLAND INC,TOWSON,MD
582608783,PRESERVING BIBLE TIMES INC,GAITHERSBURG,MD
810572412,PRESTON MITCHUM JR FOUNDATION,CATONSVILLE,MD
521847976,PRIMARY CARE COALITION OF MONTGOMERY COUNTY MD INC,SILVERSPRING,MD
520657413,PRIMARY DAY SCHOOL INC,BETHESDA,MD
810617371,PRIME CARE INTERNATIONAL INC,GWYNN OAK,MD
611616078,PRINCE GEORGES COALITION AGAINST DOMESTIC VIOLENCE,HYATTSVILLE,MD
521429938,PRINCE GEORGES COMMUNITY COLLEGE FOUNDATION INC,LARGO,MD
753263522,PRINCE GEORGES COUNTY YOUTH GOLF ACADEMY,MITCHELLVILLE,MD
273715955,PRINCE GEORGES CULTURAL ARTS FOUNDATION,MITCHELLVILLE,MD
237064117,PRINCE GEORGES GENEALOGICAL SOCIETY INC,BOWIE,MD
521086858,PRINCE GEORGES PHILHARMONIC,RIVERDALE,MD
