EIN,Name,City,State
521764090,NOYES CHILDRENS LIBRARY FOUNDATION INC,KENSINGTON,MD
462752094,NU DIRECTION INC,BALTIMORE,MD
271965216,NUFDI FUND INC,POTOMAC,MD
461086098,NURSING HEART INC,BALTIMORE,MD
50559626,NUTRITIONFACTS ORG INC,KENSINGTON,MD
521874053,OAK CREST VILLAGE INC,PARKVILLE,MD
522305177,OAKDALE CHRISTIAN ACADEMY INC,OLNEY,MD
521019433,OAKLAND MILLS INTERFAITH INC,COLUMBIA,MD
526054320,OAKLAND VOLUNTEER FIRE DEPARTMENT INC,OAKLAND,MD
383902126,OBAMAS CHILDREN INC,GERMANTOWN,MD
820774331,OCEAN CITY BEACH PATROL MARYLAND CHAPTER OF THE UNITED STATES LIFES,OCEAN CITY,MD
272151222,OCEAN CITY CHAMBER OF COMMERCE FOUNDATION INC,OCEAN CITY,MD
522222484,OCEAN CITY DEVELOPMENT CORPORATION,OCEAN CITY,MD
383698991,OCEAN CITY LIONS CHARITIES INC,OCEAN CITY,MD
311640641,OCEAN PINES CHILDRENS THEATER,OCEAN PINES,MD
521530218,OCEANITES INC,CHEVY CHASE,MD
460865784,OCHS FAMILY FOUNDATION,BALTIMORE,MD
841670822,OCPHC CHARITIES INC,OCEAN CITY,MD
521661804,ODENTON HERITAGE SOCIETY INC,ODENTON,MD
522030205,ODENTON SENIOR HOUSING INC,TIMONIUM,MD
30482876,ODONNELL HEIGHTS TENANT COUNCIL,BALTIMORE,MD
522101501,OFFICE MANAGEMENT AND TECHNOLOGY INC,ESSEX,MD
331202139,OLD BO BOYS ASSOCIATION USA INC,UPPR MARLBORO,MD
263089811,OLD LINE STATE LACROSSE CLUB,ARNOLD,MD
521444286,OLDE MILL BAND BOOSTERS ASSOCIATION INC,MILLERSVILLE,MD
522218178,OLDTOWN COMMUNITY CENTER INC,OLDTOWN,MD
262348038,OLF SENIOR HOUSING INC,BALTIMORE,MD
453025889,OLIVIA CONSTANTS FOUNDATION INC,ANNAPOLIS,MD
521149571,OLNEY THEATRE CORPORATION,OLNEY,MD
451866500,OMINSKY FAMILY CHARITABLE FOUNDATION INC,COLUMBIA,MD
521226449,OMNI HOUSE INC,GLEN BURNIE,MD
522046050,ON OUR OWN FREDERICK COUNTY INC,FREDERICK,MD
522290119,ON OUR OWN OF CARROLL COUNTY INC,WESTMINSTER,MD
521812414,ON OUR OWN OF MARYLAND INC,ELKRIDGE,MD
522176441,ONE CHURCH ONE CHILD OF MARYLAND INC,BALTIMORE,MD
800222081,ONE DAY AT A TIME INC,CAPITOL HGTS,MD
611408562,ONE MOUNTAIN FOUNDATION,CASCADE,MD
522211189,OPEN DOOR CHRISTIAN CENTER,OWINGS MILLS,MD
522293872,OPEN MIND FOUNDATION,SHERWOOD,MD
454733758,OPEN MIND INTERNATIONAL INC,BETHESDA,MD
521159823,OPPORTUNITY BUILDERS ASSOC OF PARENTS INC,PASADENA,MD
454599833,OPPORTUNITY MINISTRIES INC,PASADENA,MD
521488708,OPTIMIST CLUB FOUNDATION OF ROCKVILLE MD INC,ROCKVILLE,MD
522332656,OR HAOLAM LIGHT OF THE WORLD MINISTRIES INC,GAITHERSBURG,MD
455044620,ORCHESTRA PROJECT,MONTGOMRY VLG,MD
522151842,ORGANIZATION OF HISPANIC-LATIN AMERICANS OF ANNE ARUNDEL CO INC,HARWOOD,MD
273857812,ORLU PROVINCIAL UNION FOUNDATION INC,PIKESVILLE,MD
471334325,ORRSON FAMILY FOUNDATION INC,TOWSON,MD
812157591,ORTHODOX JEWISH NURSES ASSOCIATION INC,OLNEY,MD
141862154,OSPREY FOUNDATION INC,TOWSON,MD
237076021,OSTEOGENESIS IMPERFECTA FOUNDATION INC,GAITHERSBURG,MD
311699713,OTTLEY MUSIC SCHOOL INC,HYATTSVILLE,MD
522436559,OUR FORTRESS HOMES INC,BALTIMORE,MD
263022809,OUR LITTLE JEWELS INC,ELLICOTT CITY,MD
522089675,OUR TOWN THEATRE INC,OAKLAND,MD
262113448,OUT CAME THE SUN FOUNDATION INC,ROCKVILLE,MD
452482209,OUT FOR JUSTICE INC,BALTIMORE,MD
274284348,OUTERARTS MARYLAND INC,CHESTERTOWN,MD
472286642,OUTERARTS MARYLAND INC,CHESTERTOWN,MD
352433311,OUTLAW KITTIES TRAP NEUTER RETURN & RESCUE CORPORATION,HYATTSVILLE,MD
273856852,OUTWARD ADVENTURES INC,SEVERN,MD
521556524,OVERLEA FULLERTON SENIOR CENTER COUNCIL,BALTIMORE,MD
522194493,OWELLI DEVELOPMENT UNION-USA LIMITED,UPPR MARLBORO,MD
521513303,OWEN M JOHNSON FAMILY FOUNDATION,POTOMAC,MD
520915635,OWINGS MILLS VOLUNTEER FIRE COMPANY OF BALTIMORE COUNTY INC,OWINGS MILLS,MD
205726773,OWINGS OUTLAWS INC,OWINGS,MD
521186193,OXFORD COMMUNITY CENTER INC,OXFORD,MD
521297736,OXFORD KIDS CAMP INC,OXFORD,MD
522203073,OXON HILLS HIGH SCHOOL INSTRUMENTAL MUSIC DEPARTMENT BOOSTERS ASSOC,OXON HILL,MD
470927847,P FRANCIS MURPHY JUSTICE AND PEACE INITIATIVE,TOWSON,MD
371705813,P I T S SPORTS INC,UPPR MARLBORO,MD
237133352,PACIFIC COAST COLLEGE HEALTH ASSOCIATION,HANOVER,MD
30495064,PAIGE FAMILY FOUNDATION INC,BALTIMORE,MD
203758916,PAINT & POWDER CHARITY FOUNDATION FUND,TIMONIUM,MD
463194252,PAINT BRANCH ATHLETIC ASSOCIATION,BURTONSVILLE,MD
300017331,PALMER PARK SENIORS HOUSING INC,ROCKVILLE,MD
521549834,PANGASINAN ASSOCIATION INC,FT WASHINGTON,MD
141870614,PARADOX INC CREATIVE PARADOX,ANNAPOLIS,MD
352449356,PARENT BOOSTER USA INC,ELDERSBURG,MD
452648185,PARENT BOOSTER USA INC,CROFTON,MD
521379642,PARENT ENCOURAGEMENT PROGRAM INC,KENSINGTON,MD
521844962,PARENTS & FRIENDS OF THE DUKE ELLINGTON SCHOOL OF THE ARTS ET AL,UPPR MARLBORO,MD
521038628,PARENTS AFTER CHILDBIRTH EDUCATION INC,BETHESDA,MD
522065144,PARENTS PERSPECTIVE INC,POTOMAC,MD
541383012,PARIS REIDHEAD BIBLE TEACHING MINISTRIES INC,DENTON,MD
520591625,PARK SCHOOL OF BALTIMORE INC,BALTIMORE,MD
521120216,PARKINSONIAN SOCIETY OF GREATER WASHINGTON,SILVER SPRING,MD
521290418,PARKVILLE SENIOR CENTER COUNCIL,BALTIMORE,MD
527073564,PARTAN FOUNDATION 051900,TAKOMA PARK,MD
465139835,PARTNERS FOR SECULAR ACTIVISM,CROFTON,MD
311768378,PARTNERS IN EVANGELISM INC,FREDERICK,MD
522156892,PARTNERSHIP FOR A HEALTHIER CARROLL COUNTY INC,WESTMINSTER,MD
521979581,PARTNERSHIP FOR ANIMAL WELFARE INC,GREENBELT,MD
522196300,PARTNERSHIP FOR GLOBAL SECURITY,BETHESDA,MD
472182573,PASSION TO HELP INC,SILVER SPRING,MD
521226817,PATHWAYS INC,HOLLYWOOD,MD
900239030,PATRICIA AND ARTHUR EDWARDS FAMILY FOUNDATION,ANNAPOLIS,MD
260432871,PATRICIA ROGERS EDUCATIONALFOUNDATION,ST LEONARD,MD
263021483,PATTERSON MILL ATHLETIC BOOSTERS INC,BEL AIR,MD
522272934,PATTY POLLATOS FUND INC,FREDERICK,MD
